{
  "schema_version": "0.2",
  "id": "RO-CDFV-001-Ref-01B",
  "type": "research_object",
  "version": "0.2.0",
  "status": "in_review",
  "title": "CDFV-001 Ref-01B computational hydrostatic benchmark",
  "purpose": "Establish an internally reproducible vertical water-exit baseline before adding free-surface loading or experimental data.",
  "scope": {
    "configuration_id": "CDFV-001-Ref-01B",
    "research_question": "Is the prescribed-motion hydrostatic baseline internally computationally consistent under the stated assumptions?",
    "included": [
      "vertical prescribed water-exit motion",
      "gravity",
      "partially submerged buoyancy",
      "algebraic constraint force",
      "CSV integrity and force-balance verification",
      "adversarial error-detection benchmark"
    ],
    "excluded": [
      "free-surface loading",
      "drag",
      "added mass",
      "propulsion dynamics",
      "attitude coupling",
      "experimental validation"
    ]
  },
  "run_manifest_ref": "Benchmarks/ANRI-RV-001/run_manifest.json",
  "reference_configuration": {
    "configuration_id": "CDFV-001-Ref-01B",
    "mass_kg": {
      "value": 2.03,
      "unit": "kg",
      "source": "P002 Table 1 (literature reference)"
    },
    "diameter_m": {
      "value": 0.09,
      "unit": "m",
      "source": "P002 Table 1 (literature reference)"
    },
    "length_m": {
      "value": 0.323,
      "unit": "m",
      "source": "P002 Table 1 (literature reference)"
    },
    "water_density_kg_m3": {
      "value": 1000.0,
      "unit": "kg/m^3",
      "source": "assumption A-FRESHWATER (fresh water, temperature not specified)"
    },
    "gravity_m_s2": {
      "value": 9.80665,
      "unit": "m/s^2",
      "source": "assumption A-GRAVITY (standard gravity, frozen value)"
    },
    "force_tolerance_n": {
      "value": 0.0001,
      "unit": "N",
      "source": "verifier acceptance tolerance (absolute)"
    },
    "free_surface_force_n": {
      "value": 0.0,
      "unit": "N",
      "source": "assumption A-FREE-SURFACE-ZERO (term excluded from the baseline)"
    }
  },
  "claims": [
    {
      "id": "C-CDFV-001-BASELINE-CONSISTENT",
      "text": "Within the frozen reference configuration, the baseline satisfies the algebraic identity constraint_force + buoyancy - weight = 0 to within 1e-4 N for every emitted row of the three prescribed-velocity cases. This is an internal computational consistency statement about a model residual; it is not experimental validation of free-surface loading and not a physical validation of the model.",
      "status": "supported",
      "evidence_refs": [
        "E-CDFV-001-CONFIG",
        "E-CDFV-001-RESULTS"
      ],
      "validator_refs": [
        "V-ANRI-RV-001"
      ],
      "limitation_refs": [
        "L-NO-EXPERIMENT",
        "L-EXCLUDED-PHYSICS",
        "L-NEAR-NEUTRAL"
      ]
    }
  ],
  "evidence": [
    {
      "id": "E-CDFV-001-CONFIG",
      "type": "configuration",
      "source": "Research_Planning/CDFV-001_Reference_Configuration.md",
      "supports": [
        "C-CDFV-001-BASELINE-CONSISTENT"
      ],
      "status": "mapped",
      "conditions": [
        "mass=2.030 kg",
        "diameter=0.090 m",
        "length=0.323 m",
        "water density=1000 kg/m^3",
        "gravity=9.80665 m/s^2",
        "force tolerance=1e-4 N",
        "freshwater assumption"
      ],
      "values": {
        "mass_kg": {
          "value": 2.03,
          "unit": "kg"
        },
        "diameter_m": {
          "value": 0.09,
          "unit": "m"
        },
        "length_m": {
          "value": 0.323,
          "unit": "m"
        },
        "water_density_kg_m3": {
          "value": 1000.0,
          "unit": "kg/m^3"
        },
        "gravity_m_s2": {
          "value": 9.80665,
          "unit": "m/s^2"
        },
        "force_tolerance_n": {
          "value": 0.0001,
          "unit": "N"
        }
      }
    },
    {
      "id": "E-CDFV-001-RESULTS",
      "type": "calculation",
      "source": "Models/CDFV-001/Ref-01B/results/verification_report.md",
      "supports": [
        "C-CDFV-001-BASELINE-CONSISTENT"
      ],
      "status": "available",
      "conditions": [
        "0.10 m/s",
        "0.25 m/s",
        "0.50 m/s",
        "verifier checks version 0.2"
      ]
    },
    {
      "id": "E-ANRI-RV-001-ADVERSARIAL",
      "type": "calculation",
      "source": "Benchmarks/ANRI-RV-001/adversarial/adversarial_cases.json",
      "supports": [
        "C-CDFV-001-BASELINE-CONSISTENT"
      ],
      "status": "available",
      "conditions": [
        "12 adversarial cases",
        "7 fault families",
        "all three velocity cases mutated",
        "each case must be rejected by its intended check"
      ]
    }
  ],
  "validators": [
    {
      "id": "V-ANRI-RV-001",
      "name": "ANRI-RV-001 Ref-01B baseline verifier",
      "command": "python Models/CDFV-001/Ref-01B/verify_baseline.py",
      "result_ref": "Models/CDFV-001/Ref-01B/results/verification.json",
      "report_ref": "Models/CDFV-001/Ref-01B/results/verification_report.md",
      "checks_version": "0.2"
    }
  ],
  "artifacts": [
    {
      "path": "Research_Planning/CDFV-001_Reference_Configuration.md",
      "role": "input",
      "sha256": "d0045dbbbf84aca2469365b45f70d5bcfb5c22a0299948569ea4137c8c5d227d"
    },
    {
      "path": "Research_Planning/P003_Free_Surface_Loading.md",
      "role": "input",
      "sha256": "579faf820162a583c1ec4cd0b203c2d61bac030db4f6a876576ea621e67958c5"
    },
    {
      "path": "Research_Planning/P003_Stage1_Sourcing_Checklist.md",
      "role": "input",
      "sha256": "eda141607ace7599cc7ea2e7d3de1b176183eb10fd2b3595cbc5c54d95379145"
    },
    {
      "path": "Research_Planning/P003_B1_Measurement_Spec.md",
      "role": "input",
      "sha256": "e397227c9786f39bf5ba1505872a866b060c57e99d3f81d3a0fc6b5af8958a97"
    },
    {
      "path": "Research_Planning/P003_B1_Preregistration.md",
      "role": "input",
      "sha256": "bbef54a071330766c13682617b5b7c306e6f4616872db1c94e877b1a1c746557"
    },
    {
      "path": "Research_Planning/P004_Candidate_Comparison.md",
      "role": "input",
      "sha256": "f715072109a4c506282d395a421a9f0ffba69c217eae9c0da2cdc39b684a10eb"
    },
    {
      "path": "Research_Planning/P002_Data_Availability_Check.md",
      "role": "input",
      "sha256": "c59bbbbc65de762253c9b74b9e27e46391ef519da0086d514e191836455475e2"
    },
    {
      "path": "Research_Planning/P004_Added_Mass_Screening.md",
      "role": "input",
      "sha256": "dfeb9d3ea12e33cb3b94ce59a4f211a244e35a6e35bba66fe65a4c937e3f86c0"
    },
    {
      "path": "Research_Planning/P004_Added_Mass_Coefficient.md",
      "role": "input",
      "sha256": "6993b19674528f9d4f85a8ee4e400d99437a5067cd00a9aff980222d4df7eee8"
    },
    {
      "path": "Research_Planning/P004_Sensitivity_Analysis.md",
      "role": "input",
      "sha256": "ca5fd32b28d01f1c86153fc3c7dfd9c6f9ccfe60baf2ebd862b1b3d682da50f8"
    },
    {
      "path": "Research_Planning/P004_Slender_Body_Applicability.md",
      "role": "input",
      "sha256": "c051840d8bf3a8f544d735bc27253b5f26f4bc8400ddbbf22aa3d5c2d0449ceb"
    },
    {
      "path": "Experiment_Requests/CLEANROOM-Replication_Task.md",
      "role": "input",
      "sha256": "d1aff85a60c70715513d8727ddf9cffe9415c78c9bdd9c8fa81de4b68a24174e"
    },
    {
      "path": "Models/CDFV-001/Ref-01B/baseline_model.py",
      "role": "model",
      "sha256": "af613f16c1b41c0c8914d6b4d0a15634adb18b38d69c7ce7ef60eeb7eb1529d4"
    },
    {
      "path": "Models/CDFV-001/Ref-01B/verify_baseline.py",
      "role": "model",
      "sha256": "09e581d8a1b1d4920b9f50d7cc383967255f86659d5f02e0a315f97a26d4f8d0"
    },
    {
      "path": "Models/CDFV-001/Ref-01B/verify_negative_cases.py",
      "role": "model",
      "sha256": "05842d56342f5c54733f8149f3c8a3fcec2add729d3d25cc96e2088f7148018a"
    },
    {
      "path": "scripts/scan_identifiers.py",
      "role": "model",
      "sha256": "a19d91749fe4f93c0bc3e68689ae6ed41d579ace465c899c3a0508d1b7d51bf9"
    },
    {
      "path": "scripts/install_git_hooks.py",
      "role": "model",
      "sha256": "4fc5ac862b3b985a7bd7744ad996743de1d73c3f22e3ff277915a788b8f9bb9d"
    },
    {
      "path": "Models/CDFV-001/Ref-01B/README.md",
      "role": "report",
      "sha256": "766ae4b492ae5813918199bc1b8dfb52e9001cff23636b1f94fb89ee92b6da2d"
    },
    {
      "path": "Models/CDFV-001/Ref-01B/results/README.md",
      "role": "report",
      "sha256": "e2b23ec795a892c9219ecfe65c43f87600f7b2a4335dfde079bcb57d497d75aa"
    },
    {
      "path": "Models/CDFV-001/Ref-01B/results/Ref-01B-B-0p10mps.csv",
      "role": "result",
      "sha256": "5bd286dff8fd7e95ca1f7efe89324d465ba72de75c86fc3d6d7cb2077eaf2521"
    },
    {
      "path": "Models/CDFV-001/Ref-01B/results/Ref-01B-B-0p25mps.csv",
      "role": "result",
      "sha256": "7ab66dae1f65e588d2980db43715bc01044a7bafba37be547d9d86a349817e76"
    },
    {
      "path": "Models/CDFV-001/Ref-01B/results/Ref-01B-B-0p50mps.csv",
      "role": "result",
      "sha256": "721bb09efc6c9fc6067a16a6bd1e1004a086e8813f100debb913a246e12cc666"
    },
    {
      "path": "Models/CDFV-001/Ref-01B/results/Ref-01B-B-0p10mps-a0p10mps2.csv",
      "role": "result",
      "sha256": "3d66b32b9159ab126878a5c86fe36cbbd91f004cd1246c9c691a431641bc7019"
    },
    {
      "path": "Models/CDFV-001/Ref-01B/results/Ref-01B-B-0p10mps-a1p00mps2.csv",
      "role": "result",
      "sha256": "8d70a8edab95517552fe6f45287567de68df9ae7464797c03619baacc2bf0605"
    },
    {
      "path": "Models/CDFV-001/Ref-01B/results/Ref-01B-B-0p25mps-a0p10mps2.csv",
      "role": "result",
      "sha256": "cc4cd3b0546d20d8abedbdf9b096b8d4823e88105efb66cf09f1a55e4269747b"
    },
    {
      "path": "Models/CDFV-001/Ref-01B/results/Ref-01B-B-0p25mps-a1p00mps2.csv",
      "role": "result",
      "sha256": "dc97e123c89ff8e3de0de2368b1fefc2741abe872e1e582d70f05807f23ad3f9"
    },
    {